,tweetid,userid,user_display_name,user_screen_name,user_reported_location,user_profile_description,user_profile_url,follower_count,following_count,account_creation_date,account_language,tweet_language,tweet_text,tweet_time,tweet_client_name,in_reply_to_tweetid,in_reply_to_userid,quoted_tweet_tweetid,is_retweet,retweet_userid,retweet_tweetid,latitude,longitude,quote_count,reply_count,like_count,retweet_count,hashtags,urls,user_mentions,poll_choices
0,694577686165995520,2912754262,Pigeon Today,PigeonToday,United States,"America’s Weakest Primetime Lineup Anywhere! Follow Merica's #1 cable news network, delivering you breaking news, insightful analysis, and must-see memes.",http://t.co/h5ZYn94UBQ,32347,21336,2014-12-09,en,en,I don't always vote #Democrat but when I do it's because I'm dead and someone's using my name https://t.co/5N691AC4Pl,2016-02-02 17:46,Twitter Web Client,,,,False,,,,,0.0,3.0,56.0,61.0,[Democrat],[],,
1,686121377275973632,2912754262,Pigeon Today,PigeonToday,United States,"America’s Weakest Primetime Lineup Anywhere! Follow Merica's #1 cable news network, delivering you breaking news, insightful analysis, and must-see memes.",http://t.co/h5ZYn94UBQ,32347,21336,2014-12-09,en,en,#Socialist vs #Democrat – What’s the difference? https://t.co/yop4K5HOgN,2016-01-10 09:44,Twitter Web Client,,,,False,,,,,0.0,2.0,4.0,12.0,"[Socialist, Democrat]",[],,
2,688795415240544256,4437444442,Pamela Kealer,PamelaKealer13,"Texas, USA",,,10226,10184,2015-12-10,en,en,It's nice to hear a #democrat admit they're intolerant of people who disagree with them ☺ https://t.co/5DNS08ah6l https://t.co/qpLfAzMqQ3,2016-01-17 18:49,Twitter Web Client,,,,False,,,,,0.0,2.0,21.0,33.0,[democrat],[http://www.theguardian.com/commentisfree/2014/jan/24/governor-cuomo-conservatives-not-welcome-new-york],,
3,687411337123774464,4437444442,Pamela Kealer,PamelaKealer13,"Texas, USA",,,10226,10184,2015-12-10,en,en,#Obama always says that our economy is great then why are almost all #Democrat candidates promising to fix economy? https://t.co/R3pjW8XtIr,2016-01-13 23:10,Twitter Web Client,,,,False,,,,,0.0,1.0,14.0,21.0,"[Obama, Democrat]",[],,
4,776069457311567872,2882350436,Christian Morgan,ChrixMorgan,USA,I'm so funny. I can make myself laugh,,22035,9795,2014-10-29,en,en,RT @Rc_Darr: #IfIHadABodyDouble I'd run for #President as a #democrat,2016-09-14 14:45,Twitter Web Client,,,,True,370253717,7.760683178743849e+17,,,0.0,0.0,0.0,0.0,"[IfIHadABodyDouble, President, democrat]",[],[370253717],
5,577408797435518976,2742482932,Casey Pittman,cascaseyp,"London, England",Do not let what you cannot do interfere with what you can do.,,5328,4282,2014-08-14,en,en,RT @DMashak: #Progressive Pro #NWO #Republican #RINO Rockefeller expounds on merits of #RedChina #TEAParty #OWS #P2 #Democrat http://t.co/x…,2015-03-16 09:59,TweetDeck,,,,True,10207502,5.774079173824799e+17,,,0.0,0.0,0.0,0.0,"[Progressive, NWO, Republican, RINO, RedChina, TEAParty, OWS, P2, Democrat]",[http://bit.ly/19muTHT],[10207502],
6,654351983432699904,2882331822,Jenna Abrams,Jenn_Abrams,USA,"Calm down, I'm not pro-Trump. I am pro-common sense. Any offers/ideas/questions? DM or email me jennnabrams@gmail.com (Yes, there are 3 Ns)",https://t.co/ZXoG0JPLdf,79152,22607,2014-10-29,en,en,RT if #Republican  Fav if #Democrat http://t.co/A66XzcRIqC,2015-10-14 17:44,TweetDeck,,,,False,,,,,0.0,3.0,5.0,23.0,"[Republican, Democrat]",[],,
