,tweetid,userid,user_display_name,user_screen_name,user_reported_location,user_profile_description,user_profile_url,follower_count,following_count,account_creation_date,account_language,tweet_language,tweet_text,tweet_time,tweet_client_name,in_reply_to_tweetid,in_reply_to_userid,quoted_tweet_tweetid,is_retweet,retweet_userid,retweet_tweetid,latitude,longitude,quote_count,reply_count,like_count,retweet_count,hashtags,urls,user_mentions,poll_choices
0,840676207389691904,2882331822,Jenna Abrams,Jenn_Abrams,USA,"Calm down, I'm not pro-Trump. I am pro-common sense. Any offers/ideas/questions? DM or email me jennnabrams@gmail.com (Yes, there are 3 Ns)",https://t.co/ZXoG0JPLdf,79152,22607,2014-10-29,en,en,This old man is a true #hero https://t.co/G3i5OjeQ4m,2017-03-11 21:30,TweetDeck,,,,False,,,,,4.0,9.0,107.0,49.0,[hero],[],,
1,804396809963479040,4437233895,Crystal Johnson,Crystal1Johnson,"Richmond, VA",It is our responsibility to promote the positive things that happen in our communities.,,56581,31117,2015-12-10,en,en,On this day in 1955 Rosa Parks refused to sit on the back of the bus &amp; began civil rights movement that transformed American history. #Hero https://t.co/gJQdkokbVq,2016-12-01 18:48,Twitter Web Client,,,,False,,,,,18.0,3.0,372.0,323.0,[Hero],[],,
2,717041621280264196,4840551713,Black To Live,BlackToLive,,We want equality and justice! And we need you to help us. Join our team and write your own articles! DM us or send an email: BlackToLive@gmail.com,https://t.co/fqaN9czsvb,29472,12379,2016-01-24,en,en,HEARTBREAKING: Young Boy Aspiring To Become #Firefighter Meets His ‘Real #Hero’ https://t.co/kzUMeKKefv https://t.co/QDv7CDKv6O,2016-04-04 17:30,TweetDeck,,,,False,,,,,0.0,0.0,5.0,3.0,"[Firefighter, Hero]",[http://bit.ly/1Swxezd],,
3,689159852929626112,3978316814,BlackMatters,blackmattersus,,"Fast-growing black community. Latest news and everyday updates, opinions on today’s racial justice issues.#BlackMattersUS #BLM",https://t.co/oBiVuggezq,20019,14112,2015-10-22,en,en,Have you ever thought that every child deserve a hero who will look somewhat like oneself? #BlackMatters #BLM #Hero https://t.co/YQAEtL4gZt,2016-01-18 18:58,TweetDeck,,,,False,,,,,0.0,1.0,19.0,13.0,"[BlackMatters, BLM, Hero]",[],,
4,663645110224027648,3312143142,1-800-WOKE-AF,gloed_up,StLouis,No black person is ugly  #BRONZE #BlackLivesMatter #BlackToLive,,28943,12906,2015-08-11,en,en,RT @BrainFooood: #BlackHistoryMonth #BlackLivesMatter  #Hero   RIP - the ultimate price given by doing the right thing little man. https://…,2015-11-09 09:11,Twitter Web Client,,,,True,3136555641,6.636442641953341e+17,,,0.0,0.0,0.0,0.0,"[BlackHistoryMonth, BlackLivesMatter, Hero]",[https://twitter.com/gloed_up/status/663636911836102656],[3136555641],
