,tweetid,userid,user_display_name,user_screen_name,user_reported_location,user_profile_description,user_profile_url,follower_count,following_count,account_creation_date,account_language,tweet_language,tweet_text,tweet_time,tweet_client_name,in_reply_to_tweetid,in_reply_to_userid,quoted_tweet_tweetid,is_retweet,retweet_userid,retweet_tweetid,latitude,longitude,quote_count,reply_count,like_count,retweet_count,hashtags,urls,user_mentions,poll_choices
0,667890187398090752,3990577513,Tea Party News,tpartynews,,,,21498,22407,2015-10-23,en,en,Blaming everyone for your faults is the easiest thing to do #Obama just tries to save his reputation  #teapartynews https://t.co/0FjgdhKzi3,2015-11-21 02:20,TweetDeck,,,,False,,,,,0.0,0.0,6.0,7.0,"[Obama, teapartynews]",[],,
1,714918585374629891,3990577513,Tea Party News,tpartynews,,,,21498,22407,2015-10-23,en,en,It's a shame that there are so many people who don't see the difference between right and wrong.  #teapartynews https://t.co/aeoBWbGvSf,2016-03-29 20:54,TweetDeck,,,,False,,,,,0.0,0.0,22.0,27.0,[teapartynews],[],,
2,690720367929786368,3990577513,Tea Party News,tpartynews,,,,21498,22407,2015-10-23,en,en,I believe that we should stand for our country. No more illegals! #Patriots #WakeUpAmerica #teapartynews https://t.co/KBJZ8kN9TQ,2016-01-23 02:19,TweetDeck,,,,False,,,,,0.0,3.0,28.0,36.0,"[Patriots, WakeUpAmerica, teapartynews]",[],,
3,674768004329005056,3990577513,Tea Party News,tpartynews,,,,21498,22407,2015-10-23,en,und,#teapartynews #theteaparty#politics#conservative#usa#america https://t.co/dUXpDPzG38,2015-12-10 01:50,TweetDeck,,,,False,,,,,0.0,0.0,7.0,12.0,[teapartynews],[],,
4,662580397100822528,3990577513,Tea Party News,tpartynews,,,,21498,22407,2015-10-23,en,en,#BernieSanders's promises are so brilliant that it's hard to imagine how people can really believe him!#TeaPartyNews https://t.co/BsKJuXiEmc,2015-11-06 10:40,Twitter Web Client,,,,False,,,,,0.0,3.0,10.0,14.0,"[BernieSanders, TeaPartyNews]",[],,
5,703011643001688064,3990577513,Tea Party News,tpartynews,,,,21498,22407,2015-10-23,en,en,When your country has an enormous debt it's quite dumb to fund other countries  #TeaPartyNews https://t.co/tyqXESSliQ,2016-02-26 00:20,TweetDeck,,,,False,,,,,0.0,0.0,5.0,4.0,[TeaPartyNews],[],,
6,703004068076089344,3990577513,Tea Party News,tpartynews,,,,21498,22407,2015-10-23,en,en,This is how American President should look like #TeaPartyNews https://t.co/piUazqAdKY,2016-02-25 23:50,TweetDeck,,,,False,,,,,0.0,0.0,4.0,7.0,[TeaPartyNews],[],,
7,664092671334592512,3990577513,Tea Party News,tpartynews,,,,21498,22407,2015-10-23,en,en,You may also like if you've always known Obama would be a disaster. #TeaPartyNews https://t.co/BoaqVaqPvV,2015-11-10 14:50,Twitter Web Client,,,,False,,,,,0.0,0.0,8.0,6.0,[TeaPartyNews],[],,
8,700775653742804992,3990577513,Tea Party News,tpartynews,,,,21498,22407,2015-10-23,en,en,Obama believes we have to take more illegals...Doesn't that mean he wants more dead Americans? #teapartynews https://t.co/YOLi8byDfH,2016-02-19 20:15,TweetDeck,,,,False,,,,,0.0,0.0,4.0,7.0,[teapartynews],[],,
9,664453938863849472,3990577513,Tea Party News,tpartynews,,,,21498,22407,2015-10-23,en,en,"America is going to hell and we've lost our morality, we've lost common sense. #TeaPartyNews https://t.co/4C8fY47ZlA",2015-11-11 14:45,Twitter Web Client,,,,False,,,,,0.0,2.0,4.0,6.0,[TeaPartyNews],[],,
10,664566165398757376,3990577513,Tea Party News,tpartynews,,,,21498,22407,2015-10-23,en,en,"Veterans' graves were vandalized at a cemetery in West Bridgewater, MA just before the #VeteransDay #TeaPartyNews https://t.co/wS4VY5ygqC",2015-11-11 22:11,Twitter Web Client,,,,False,,,,,0.0,0.0,2.0,3.0,"[VeteransDay, TeaPartyNews]",[],,
11,666370188753793024,3990577513,Tea Party News,tpartynews,,,,21498,22407,2015-10-23,en,en,Do you remember Clint Eastwood's speech about #Obama and his empty chair? That's how it looks like. #TeaPartyNews https://t.co/PUPAm1K1K9,2015-11-16 21:40,TweetDeck,,,,False,,,,,0.0,0.0,9.0,12.0,"[Obama, TeaPartyNews]",[],,
12,669012496573997056,3990577513,Tea Party News,tpartynews,,,,21498,22407,2015-10-23,en,en,#Hillary is the worst candidate anyone can imagine. Who are those people supporting her?  #teapartynews https://t.co/e59dZYed4o,2015-11-24 04:39,TweetDeck,,,,False,,,,,0.0,0.0,1.0,6.0,"[Hillary, teapartynews]",[],,
13,703077070960656384,3990577513,Tea Party News,tpartynews,,,,21498,22407,2015-10-23,en,en,I love this one! Looks great! Agree? #TeaPartyNews https://t.co/7Hcpk6Tn9v,2016-02-26 04:40,TweetDeck,,,,False,,,,,0.0,0.0,0.0,0.0,[TeaPartyNews],[],,
14,684062125585788928,3990577513,Tea Party News,tpartynews,,,,21498,22407,2015-10-23,en,en,People do not see the difference between what is right and what is wrong no more. #Teaparty #TeaPartyNews https://t.co/kygKfBfEXS,2016-01-04 17:21,Twitter Web Client,,,,False,,,,,0.0,0.0,8.0,12.0,"[Teaparty, TeaPartyNews]",[],,
15,721153407155720192,3990577513,Tea Party News,tpartynews,,,,21498,22407,2015-10-23,en,en,.@potus cares about illegals more than he cares about our veterans and this makes me really angry! #teapartynews https://t.co/PUKnaJjR6d,2016-04-16 01:49,TweetDeck,,,,False,,,,,0.0,4.0,48.0,64.0,[teapartynews],[],[1536791610],
16,661131708151013376,3990577513,Tea Party News,tpartynews,,,,21498,22407,2015-10-23,en,en,In a hard period called #Obama we are proud of all Americans who are fighting their country back #TeaPartyNews https://t.co/JtY1D77WTw,2015-11-02 10:44,Twitter Web Client,,,,False,,,,,0.0,0.0,8.0,7.0,"[Obama, TeaPartyNews]",[],,
17,684062225938694145,3990577513,Tea Party News,tpartynews,,,,21498,22407,2015-10-23,en,en,They don't wanna make peace with anyone. They just don't care. #theteaparty #teapartynews https://t.co/FcRlfmmCAX,2016-01-04 17:21,Twitter Web Client,,,,False,,,,,0.0,0.0,9.0,6.0,"[theteaparty, teapartynews]",[],,
18,666023884412624896,3990577513,Tea Party News,tpartynews,,,,21498,22407,2015-10-23,en,en,#Liberals don't care about America. They don't get offended by the things that ruin our country #TeaPartyNews https://t.co/PM5cokxgiM,2015-11-15 22:44,Twitter Web Client,,,,False,,,,,0.0,0.0,9.0,7.0,"[Liberals, TeaPartyNews]",[],,
19,674721449123250176,3990577513,Tea Party News,tpartynews,,,,21498,22407,2015-10-23,en,en,This is our right and this is our gun permit issued more than two centuries ago.  #teaparty #teapartynews https://t.co/KRNYH0mkqS,2015-12-09 22:45,TweetDeck,,,,False,,,,,0.0,0.0,5.0,6.0,"[teaparty, teapartynews]",[],,
20,666024513478467585,3990577513,Tea Party News,tpartynews,,,,21498,22407,2015-10-23,en,en,All people around the world need to unite to battle #terrorism after the events happened in #France. #TeaPartyNews https://t.co/EjoHaiPXtq,2015-11-15 22:46,Twitter Web Client,,,,False,,,,,0.0,0.0,7.0,5.0,"[terrorism, France, TeaPartyNews]",[],,
21,666022200533778436,3990577513,Tea Party News,tpartynews,,,,21498,22407,2015-10-23,en,en,#Liberals claim they are open minded but they get mad every time they see a Christian patriot. #TeaPartyNews https://t.co/2BBiwUREPm,2015-11-15 22:37,Twitter Web Client,,,,False,,,,,0.0,4.0,5.0,12.0,"[Liberals, TeaPartyNews]",[],,
22,662579971508953088,3990577513,Tea Party News,tpartynews,,,,21498,22407,2015-10-23,en,en,The best illustration for the #PoliceBrutality. #TeaPartyNews https://t.co/thJqYkBn5k,2015-11-06 10:39,Twitter Web Client,,,,False,,,,,0.0,1.0,12.0,26.0,"[PoliceBrutality, TeaPartyNews]",[],,
23,663738160472567809,3990577513,Tea Party News,tpartynews,,,,21498,22407,2015-10-23,en,en,What's wrong with our #democrats? #TeaPartyNews https://t.co/fH2pdhAH1l,2015-11-09 15:21,Twitter Web Client,,,,False,,,,,0.0,0.0,1.0,5.0,"[democrats, TeaPartyNews]",[],,
24,702996536859332609,3990577513,Tea Party News,tpartynews,,,,21498,22407,2015-10-23,en,en,I can't believe Hillary has a chance to become the next US President #teapartynews https://t.co/7Agpg7hyS4,2016-02-25 23:20,TweetDeck,,,,False,,,,,0.0,2.0,2.0,2.0,[teapartynews],[],,
25,703041835711594496,3990577513,Tea Party News,tpartynews,,,,21498,22407,2015-10-23,en,en,I'm proud to be conservative. I'm proud to be everything liberals hate.  #TeaPartyNews https://t.co/C4ayT0WJ6C,2016-02-26 02:20,TweetDeck,,,,False,,,,,0.0,0.0,5.0,0.0,[TeaPartyNews],[],,
26,669010222434934784,3990577513,Tea Party News,tpartynews,,,,21498,22407,2015-10-23,en,en,I will not apologize for standing for #guns because it's my right provided by the #Constitution  #teapartynews https://t.co/KdNwx5U5RN,2015-11-24 04:30,TweetDeck,,,,False,,,,,0.0,1.0,6.0,8.0,"[guns, Constitution, teapartynews]",[],,
27,703069496890621952,3990577513,Tea Party News,tpartynews,,,,21498,22407,2015-10-23,en,en,I believe that #feminism is a movement to find apologizes for a shameless behavior #TeaPartyNews https://t.co/dYIxHztq64,2016-02-26 04:10,TweetDeck,,,,False,,,,,0.0,0.0,11.0,9.0,"[feminism, TeaPartyNews]",[],,
28,703087129505574913,3990577513,Tea Party News,tpartynews,,,,21498,22407,2015-10-23,en,en,The idea to ban and register guns is really stupid. #TeaPartyNews https://t.co/eY4xXRM9j4,2016-02-26 05:20,TweetDeck,,,,False,,,,,0.0,0.0,4.0,5.0,[TeaPartyNews],[],,
29,703046868381540354,3990577513,Tea Party News,tpartynews,,,,21498,22407,2015-10-23,en,en,After 20 years in politics and only 1 bill passed she won't make a good president #TeaPartyNews https://t.co/I5sQzEgY0v,2016-02-26 02:40,TweetDeck,,,,False,,,,,0.0,0.0,9.0,7.0,[TeaPartyNews],[],,
30,703056954826973184,3990577513,Tea Party News,tpartynews,,,,21498,22407,2015-10-23,en,en,"With Hillary in charge, America will burn in flames of a shame. So don't let this happen! #TeaPartyNews https://t.co/3Mzz5uibaJ",2016-02-26 03:20,TweetDeck,,,,False,,,,,0.0,1.0,19.0,18.0,[TeaPartyNews],[],,
31,684062817427787776,3990577513,Tea Party News,tpartynews,,,,21498,22407,2015-10-23,en,en,This is not about being black. It's about the importance of education. #Teaparty #TeaPartyNews https://t.co/1f9Jl48h7F,2016-01-04 17:24,Twitter Web Client,,,,False,,,,,0.0,0.0,16.0,13.0,"[Teaparty, TeaPartyNews]",[],,
32,717756773768101888,3990577513,Tea Party News,tpartynews,,,,21498,22407,2015-10-23,en,en,That's really funny and that's really cool. #TeaParty #TeaPartyNews https://t.co/7dRWJvhZCM,2016-04-06 16:52,TweetDeck,,,,False,,,,,0.0,2.0,23.0,27.0,"[TeaParty, TeaPartyNews]",[],,
33,702986661039370241,3990577513,Tea Party News,tpartynews,,,,21498,22407,2015-10-23,en,en,I believe it's fair. LIKE if you too! #teapartynews https://t.co/foGLC7vdeO,2016-02-25 22:40,TweetDeck,,,,False,,,,,0.0,0.0,4.0,2.0,[teapartynews],[],,
34,717734125487034368,3990577513,Tea Party News,tpartynews,,,,21498,22407,2015-10-23,en,en,Did you know that April is a #ConfederateHeritageMonth ? #TeaPartyNews https://t.co/PbAp2uYNTE,2016-04-06 15:22,TweetDeck,,,,False,,,,,0.0,1.0,8.0,8.0,"[ConfederateHeritageMonth, TeaPartyNews]",[],,
35,703026745373384705,3990577513,Tea Party News,tpartynews,,,,21498,22407,2015-10-23,en,und,#Hillary4Prison2016  #TeaPartyNews https://t.co/VFTQgtQcaT,2016-02-26 01:20,TweetDeck,,,,False,,,,,0.0,0.0,2.0,3.0,"[Hillary4Prison2016, TeaPartyNews]",[],,
36,708467569846398976,3990577513,Tea Party News,tpartynews,,,,21498,22407,2015-10-23,en,und,#TeaPartyNews https://t.co/foiQhtcwfu,2016-03-12 01:40,TweetDeck,,,,False,,,,,0.0,0.0,1.0,0.0,[TeaPartyNews],[],,
37,663511823887507456,3990577513,Tea Party News,tpartynews,,,,21498,22407,2015-10-23,en,en,"We should stand for our freedom, we should stand for justice, we should stand for our country! #teapartynews https://t.co/xmIPYhMyOS",2015-11-09 00:22,Twitter Web Client,,,,False,,,,,0.0,0.0,3.0,1.0,[teapartynews],[],,
38,666021395088977920,3990577513,Tea Party News,tpartynews,,,,21498,22407,2015-10-23,en,en,"#Obama spends all money on vacations, useless wars and immigrants. There are better ways to spend it. #teapartynews https://t.co/OohAnS6Axo",2015-11-15 22:34,Twitter Web Client,,,,False,,,,,0.0,0.0,5.0,6.0,"[Obama, teapartynews]",[],,
39,721169014945230849,3990577513,Tea Party News,tpartynews,,,,21498,22407,2015-10-23,en,en,How can we trust a woman who can't even handle two e-mails at once? @HillaryClinton #treason #teapartynews https://t.co/91J353fi6U,2016-04-16 02:51,TweetDeck,,,,False,,,,,0.0,1.0,34.0,62.0,"[treason, teapartynews]",[],[1339835893],
40,700393883847499777,3990577513,Tea Party News,tpartynews,,,,21498,22407,2015-10-23,en,en,"if you believe there's something wrong, you DO have a chance to change it! #teapartynews https://t.co/dwSv5OV1aH",2016-02-18 18:58,Twitter Web Client,,,,False,,,,,0.0,0.0,2.0,1.0,[teapartynews],[],,
41,666367721882320896,3990577513,Tea Party News,tpartynews,,,,21498,22407,2015-10-23,en,en,#Terrorists are hiding somewhere behind us waiting for the proper moment to attack us. Stop them! #TeaPartyNews https://t.co/PlPfOGKmv6,2015-11-16 21:30,TweetDeck,,,,False,,,,,0.0,1.0,6.0,11.0,"[Terrorists, TeaPartyNews]",[],,
42,715167387704758272,3990577513,Tea Party News,tpartynews,,,,21498,22407,2015-10-23,en,en,"Gun free killing zones is a sick idea of a frankly mad President. Thanks, Obama. #TeaPartyNews https://t.co/ycRZSW7G5g",2016-03-30 13:22,Twitter Web Client,,,,False,,,,,0.0,0.0,8.0,18.0,[TeaPartyNews],[],,
43,703034285461098496,3990577513,Tea Party News,tpartynews,,,,21498,22407,2015-10-23,en,en,Obama has a strange vision of what is important to America.  #TeaPartyNews https://t.co/LsVLvCCIkX,2016-02-26 01:50,TweetDeck,,,,False,,,,,0.0,0.0,4.0,6.0,[TeaPartyNews],[],,
44,684063096042844160,3990577513,Tea Party News,tpartynews,,,,21498,22407,2015-10-23,en,en,#Obama wants us to HATE! #teaParty #TeaPartyNews https://t.co/ccKzSFet5H,2016-01-04 17:25,Twitter Web Client,,,,False,,,,,0.0,3.0,14.0,13.0,"[Obama, teaParty, TeaPartyNews]",[],,
45,669017663088099334,3990577513,Tea Party News,tpartynews,,,,21498,22407,2015-10-23,en,en,#Liberals support #gays and #muslims who behead them at the same time. Are they bipolar or what? #teapartynews https://t.co/BQvjMbCEsf,2015-11-24 05:00,TweetDeck,,,,False,,,,,0.0,1.0,2.0,3.0,"[Liberals, gays, muslims, teapartynews]",[],,
46,690704794487496704,3990577513,Tea Party News,tpartynews,,,,21498,22407,2015-10-23,en,en,That's what I'm talking about all the time: choose adoption instead of abortion! #TeaParty #teapartynews https://t.co/ejzpKaiHgX,2016-01-23 01:17,TweetDeck,,,,False,,,,,0.0,1.0,6.0,9.0,"[TeaParty, teapartynews]",[],,
47,703061966579838977,3990577513,Tea Party News,tpartynews,,,,21498,22407,2015-10-23,en,en,"I believe we, Americans, are smart enough to make a right choice. #TeaPartyNews https://t.co/wxJUAXsW4z",2016-02-26 03:40,TweetDeck,,,,False,,,,,0.0,0.0,1.0,1.0,[TeaPartyNews],[],,
48,694623156682752004,3990577513,Tea Party News,tpartynews,,,,21498,22407,2015-10-23,en,en,"For the sake of our future and the future of our country, we should make America great again! #teapartynews https://t.co/BrwXkNGtMA",2016-02-02 20:47,Twitter Web Client,,,,False,,,,,0.0,2.0,22.0,19.0,[teapartynews],[],,
49,669015102633340929,3990577513,Tea Party News,tpartynews,,,,21498,22407,2015-10-23,en,en,Why does #Obama try to do his best to please the illegals? Why doesn't he care about Americans? #teapartynews https://t.co/0OjIPFTJTO,2015-11-24 04:50,TweetDeck,,,,False,,,,,0.0,0.0,7.0,8.0,"[Obama, teapartynews]",[],,
50,703019170577801216,3990577513,Tea Party News,tpartynews,,,,21498,22407,2015-10-23,en,en,"It makes sense, don't you think? Why democrats need all those illegals here? #TeaPartyNews https://t.co/ASPkH5JngS",2016-02-26 00:50,TweetDeck,,,,False,,,,,0.0,1.0,3.0,6.0,[TeaPartyNews],[],,
51,703041832653983745,3990577513,Tea Party News,tpartynews,,,,21498,22407,2015-10-23,en,en,"Wanna call illegals undocumented? So let's call everything that runs counter to a law ""undocumented"" #TeaPartyNews https://t.co/IBpN2DyhqO",2016-02-26 02:20,TweetDeck,,,,False,,,,,0.0,0.0,4.0,4.0,[TeaPartyNews],[],,
